<?xml version="1.0" encoding="UTF-8"?>
<elenco_messaggi xmlns:xsi="http://www.w3.org/2001/XMLSchema-instance" xsi:noNamespaceSchemaLocation="gestioneMessaggiCreaArea.xsd"><messaggio><ID_UT>4</ID_UT><flag_sender>0</flag_sender><testoMess>Vorrei che aggiungesse Battflefield come gioco</testoMess><flag_lettura>0</flag_lettura></messaggio><messaggio><ID_UT>4</ID_UT><flag_sender>0</flag_sender><testoMess>vorrei bannare tizio</testoMess><flag_lettura>0</flag_lettura></messaggio><messaggio><ID_UT>4</ID_UT><flag_sender>1</flag_sender><testoMess>va bene</testoMess><flag_lettura>0</flag_lettura></messaggio></elenco_messaggi>
